experiment	agent_iteration	commit	time_us	status	description
1	0	HEAD	10876.75	keep	Baseline 'starting_point' — initial benchmark
2	1	HEAD	9295.66	keep	Advisor proposed establishing a clean low-overhead PyTorch reference: eliminate per-call module/para
3	2	HEAD	7298.39	keep	Advisor proposed pushing the PyTorch contraction further: tune matmul precision and reduce layout/ma
4	3	HEAD	6320.64	keep	Advisor's primary direction: wrap the full compute pipeline in torch.compile with a cached compiled 
5	4	HEAD	7369.06	discard	Advisor option (1): split the pipeline so the elementwise/projection wings stay in torch.compile but
6	5	HEAD	6082.09	keep	Advisor: mature #4's monolithic torch.compile by enabling max-autotune so inductor searches GEMM til
7	6	HEAD	16506.93	discard	Advisor: open new approach — hand-written fused Triton kernel for the contraction core, keeping laye
8	7	HEAD	4451.57	keep	Advisor step (1): fix #7's layout bug by feeding the Triton contraction a contiguous-K (B*H,N,N) fp1
9	8	HEAD	4278.06	keep	Advisor step (1): add Triton autotuning over the contraction kernel's block shape and warp/stage par
10	9	HEAD	6964.57	discard	Advisor step (2) option (a): partial epilogue fusion — write the contraction output directly in cons
11	10	HEAD	5835.22	discard	Advisor prologue direction (1): batch the 5 projections (left/right proj+gate + out_gate) into a sin
12	11	HEAD	6111.59	discard	Advisor option (b): the deferred fused-epilogue swing. Implemented a dedicated Triton _epilogue_kern
13	12	HEAD	6194.49	discard	Advisor: stop fusion surgery; tune INSIDE the #9 GEMM via (1) group-M L2-reuse program swizzle and (
14	13	HEAD	6214.05	discard	Advisor thread (1): stabilize #9's autotune by pruning the 48-config search to a small hand-curated 
15	14	HEAD	0.00	crash	Advisor: enrich the autotune candidate pool as a STRICT SUPERSET of #9's 48 configs (keep kernel bod
16	15	HEAD	6169.69	discard	#16 (advisor's last principled GEMM-tuning swing): enrich the contract autotune config set to a supe
17	16	HEAD	6202.60	discard	Advisor's "eliminate autotune nondeterminism" pivot: removed @triton.autotune entirely and replaced 
18	17	HEAD	6122.51	keep	Advisor's deferred precision probe: change the contraction's output buffer from fp32 to fp16 (single
19	18	HEAD	5885.52	keep	Advisor's cuBLAS bmm swap: replace the hand-written Triton contraction with torch.bmm(left, right.tr
20	19	HEAD	7057.56	discard	Advisor avenue 1: drop the explicit .contiguous() full-tensor copies in the pre-stage and hand cuBLA
21	20	HEAD	5959.87	discard	Advisor avenue 1 (epilogue fusion): move the cuBLAS-output reshape/permute (B*H,N,N)->(B,N,N,H) from
22	21	HEAD	6290.04	discard	Advisor's size-conditioned hybrid contiguity dispatch: harvest #20's observation that dropping .cont
23	22	HEAD	5882.30	keep	Advisor's finalization/reproducibility directive: architecture declared mature at #19 (5885us) after
24	23	HEAD	5906.43	keep	Advisor's final lock-in directive: architecture finalized at #23/#19 (cuBLAS bmm on contiguous-K fp1
25	24	HEAD	5914.41	keep	Advisor's final lock-in (iteration 24/25): kernel is finalized; perform only a purely confirmatory v
26	25	HEAD	5908.46	keep	FINAL iteration (25/25): lock in the deliverable. File was already byte-exact the finalized #19/#23/
